{
  "experiment_id": "disable_frontend_retry_fb64bb17",
  "hypothesis_id": "H1",
  "template_name": "disable_frontend_retry",
  "intervention": "MAX_RETRIES=0 \u2014 client sends payment request exactly once, no client-side retry",
  "baseline": "Client retries payment on failure (MAX_RETRIES=1); service retry loop active",
  "transactions_created": 2,
  "duplicate_count": 1,
  "retry_log_entries": [
    "attempt 1: POST /charge payment_id=EXP-A-001",
    "attempt 1: response status=200",
    "attempt 2: POST /charge payment_id=EXP-A-001",
    "attempt 2: response status=200"
  ],
  "backend_calls": 2,
  "result": "FALSIFIED",
  "reason": "H1 FALSIFIED: duplicate_count=1 even with client retry disabled (MAX_RETRIES=0). The service retry loop (SERVICE_RETRY_ON_TIMEOUT=1) still executed 2 backend calls, creating 2 transactions. Client retry behavior is NOT the root cause.",
  "raw_evidence": [
    {
      "transaction_id": "4360a7fe-8559-4d93-be57-87fa756cf479",
      "payment_id": "EXP-A-001",
      "amount": 50.0,
      "status": "charged",
      "created_at": 1790505154.1084185
    },
    {
      "transaction_id": "d4cd8893-bfb3-4b1b-a3ca-0c6566e9e3e8",
      "payment_id": "EXP-A-001",
      "amount": 50.0,
      "status": "charged",
      "created_at": 1790505154.109468
    }
  ],
  "timestamp": "2026-09-27T10:32:34.110003+00:00"
}