{
  "experiment_id": "inject_backend_timeout_ef5e17a4",
  "hypothesis_id": "H2",
  "template_name": "inject_backend_timeout",
  "intervention": "SERVICE_RETRY_ON_TIMEOUT=1 \u2014 service retry loop executes multiple backend calls per request",
  "baseline": "SERVICE_RETRY_ON_TIMEOUT=0 \u2014 service makes exactly one backend call per request",
  "transactions_created": 2,
  "duplicate_count": 1,
  "retry_log_entries": [
    "attempt 1: POST /charge payment_id=EXP-B-001",
    "attempt 1: response status=200",
    "attempt 2: POST /charge payment_id=EXP-B-001",
    "attempt 2: response status=200"
  ],
  "backend_calls": 2,
  "result": "SUPPORTED",
  "reason": "H2 SUPPORTED: duplicate_count=1 from a SINGLE client request (no client retry). The service retry loop executed 2 backend calls, creating 2 transactions. Root cause: service/main.py process_payment() loop does not break after first successful charge \u2014 no idempotency check prevents duplicate transactions.",
  "raw_evidence": [
    {
      "transaction_id": "f261db90-5250-4f9b-adcf-8ab49fc42e9f",
      "payment_id": "EXP-B-001",
      "amount": 50.0,
      "status": "charged",
      "created_at": 1790505154.8608353
    },
    {
      "transaction_id": "8859865f-cfcc-42f3-b0f2-3af194ee0bb6",
      "payment_id": "EXP-B-001",
      "amount": 50.0,
      "status": "charged",
      "created_at": 1790505154.8617966
    }
  ],
  "timestamp": "2026-09-27T10:32:34.862356+00:00"
}